{
  "mif_version": "2.0",
  "generator": {
    "name": "shodh-memory",
    "version": "0.1.80"
  },
  "export_meta": {
    "id": "550e8400-e29b-41d4-a716-446655440000",
    "created_at": "2026-03-03T10:00:00Z",
    "user_id": "developer-1",
    "checksum": "sha256:9f86d081884c7d659a2feaa0c55ad015a3bf4f1b2b0b822cd15d6c15b0f00a08",
    "privacy": {
      "pii_detected": false,
      "redacted_fields": []
    }
  },
  "memories": [
    {
      "id": "123e4567-e89b-12d3-a456-426614174000",
      "content": "User prefers dark mode across all applications",
      "memory_type": "decision",
      "created_at": "2026-01-15T10:30:00Z",
      "tags": ["preferences", "ui"],
      "entities": [
        { "name": "dark mode", "entity_type": "concept", "confidence": 1.0 }
      ],
      "embeddings": {
        "model": "minilm-l6-v2",
        "dimensions": 384,
        "vector": [0.012, -0.034, 0.056],
        "normalized": true
      },
      "source": {
        "source_type": "user",
        "session_id": "session-42",
        "agent_name": "claude-code"
      },
      "parent_id": null,
      "related_memory_ids": [],
      "version": 1
    },
    {
      "id": "234f5678-f9ab-23e4-b567-537725285111",
      "content": "Project architecture: Rust core with RocksDB storage, MiniLM embeddings, and custom Hebbian knowledge graph",
      "memory_type": "context",
      "created_at": "2026-02-01T09:00:00Z",
      "tags": ["architecture", "rust", "rocksdb"],
      "entities": [
        { "name": "Rust", "entity_type": "technology", "confidence": 0.99 },
        { "name": "RocksDB", "entity_type": "technology", "confidence": 0.99 },
        { "name": "MiniLM", "entity_type": "technology", "confidence": 0.95 }
      ],
      "source": {
        "source_type": "ai_generated",
        "agent_name": "claude-code"
      },
      "version": 1
    },
    {
      "id": "345a6789-abcd-34f5-c678-648836396222",
      "content": "Deadlock fixed: parking_lot::Mutex is not re-entrant. Split user_memory_init_locks and user_graph_init_locks into separate DashMaps.",
      "memory_type": "learning",
      "created_at": "2026-02-28T16:45:00Z",
      "tags": ["bug-fix", "concurrency", "deadlock"],
      "entities": [
        { "name": "parking_lot", "entity_type": "technology", "confidence": 0.9 },
        { "name": "DashMap", "entity_type": "technology", "confidence": 0.85 }
      ],
      "related_memory_ids": ["234f5678-f9ab-23e4-b567-537725285111"],
      "version": 1
    }
  ],
  "knowledge_graph": {
    "entities": [
      {
        "id": "ent-001",
        "name": "Rust",
        "types": ["technology"],
        "attributes": { "category": "programming_language" },
        "summary": "Systems programming language used for the core codebase",
        "created_at": "2026-01-01T00:00:00Z",
        "last_seen_at": "2026-03-01T00:00:00Z"
      },
      {
        "id": "ent-002",
        "name": "RocksDB",
        "types": ["technology"],
        "attributes": { "category": "database" },
        "summary": "Embedded key-value store used for persistent storage",
        "created_at": "2026-01-01T00:00:00Z",
        "last_seen_at": "2026-03-01T00:00:00Z"
      }
    ],
    "relationships": [
      {
        "id": "rel-001",
        "source_entity_id": "ent-001",
        "target_entity_id": "ent-002",
        "relation_type": "works_with",
        "context": "Rust application uses RocksDB for storage via rust-rocksdb bindings",
        "confidence": 0.95,
        "created_at": "2026-01-15T00:00:00Z",
        "invalidated_at": null
      }
    ]
  },
  "vendor_extensions": {
    "shodh-memory": {
      "memory_metadata": {
        "123e4567-e89b-12d3-a456-426614174000": {
          "importance": 0.85,
          "access_count": 12,
          "activation": 0.73,
          "tier": "LongTerm"
        },
        "234f5678-f9ab-23e4-b567-537725285111": {
          "importance": 0.92,
          "access_count": 47,
          "activation": 0.88,
          "tier": "LongTerm"
        }
      },
      "graph_metadata": {
        "hebbian_learning_rate": 0.1,
        "ltp_threshold": 10
      }
    }
  }
}
